{
  "schema_version": "ghostlight.event_record.v0",
  "event_id": "lucent-hostage-feed-v0.turn-09.event",
  "review_status": "accepted_as_draft",
  "scene_loop_id": "lucent-hostage-feed-v0",
  "turn_id": "turn-09",
  "source_responder_output_ref": "experiments/responder-packets/lucent-hostage-feed-v0.turn-09.sol-vant.packet.capture.json",
  "actor_agent_id": "sol_vant",
  "observable_action": "Sol's fingers loosen from Juno's sleeve one at a time. His hand shakes badly enough to be visible on the feed, but he shifts the grip down and clamps onto the bench edge beside her instead, keeping his body angled between Juno, the gate, and the watching apertures.",
  "spoken_text": "Fine. Bench gets the starring role. Very brave furniture. Nobody clip that like I discovered mercy under commercial lighting. The hold stays up. The rows stay named. If the edit trail blinks, I put my hand back where everyone can understand the cheaper version of me.",
  "visible_object_refs": [
    "edit-trail-hold",
    "custody-graphic-suspended",
    "elevator-gate",
    "bench-edge",
    "crisis-feed"
  ],
  "visibility_scope": "camera_mediated",
  "affected_participant_ids": [
    "sol_vant",
    "juno_ark",
    "mara_quell",
    "feed_ops_chorus"
  ],
  "public_state_changes": [
    {
      "text": "Sol moved grip from Juno's sleeve to the bench edge beside her.",
      "refs": [
        "experiments/responder-packets/lucent-hostage-feed-v0.turn-09.sol-vant.packet.capture.json",
        "coordinator-review"
      ]
    },
    {
      "text": "Juno's arm is no longer being directly held, though Sol remains close and controlling the space.",
      "refs": [
        "experiments/responder-packets/lucent-hostage-feed-v0.turn-09.sol-vant.packet.capture.json",
        "coordinator-review"
      ]
    },
    {
      "text": "Security breach pressure can remain delayed because the immediate physical threat has decreased.",
      "refs": [
        "experiments/responder-packets/lucent-hostage-feed-v0.turn-09.sol-vant.packet.capture.json",
        "coordinator-review"
      ]
    }
  ],
  "hidden_intent_handling": "Responder private_interpretation and intended_effect are preserved in the capture but are not treated as visible to other participants.",
  "review": {
    "reviewer": "Codex coordinator",
    "accepted_for_training": true,
    "rationale": "Event keeps observable action separate from actor intent and records camera-mediated visibility for appraisals.",
    "failure_labels": []
  }
}
