{
  "schema_version": "ghostlight.event_record.v0",
  "event_id": "lucent-hostage-feed-v0.turn-18.event",
  "review_status": "accepted_as_draft",
  "scene_loop_id": "lucent-hostage-feed-v0",
  "turn_id": "turn-18",
  "source_responder_output_ref": "experiments/responder-packets/lucent-hostage-feed-v0.turn-18.juno-ark.packet.capture.json",
  "actor_agent_id": "juno_ark",
  "observable_action": "Juno takes the final step onto the marked safe-line marker with both hands open and visible, then stops without turning her back on the atrium.",
  "spoken_text": "I am on the line. Nobody improve this moment. It is load-bearing and stupid enough already.",
  "visible_object_refs": [
    "edit-trail-hold",
    "custody-graphic-suspended",
    "elevator-gate",
    "bench-edge",
    "crisis-feed"
  ],
  "visibility_scope": "camera_mediated",
  "affected_participant_ids": [
    "sol_vant",
    "juno_ark",
    "mara_quell",
    "feed_ops_chorus"
  ],
  "public_state_changes": [
    {
      "text": "Juno visibly reaches the marked safe line with hands visible.",
      "refs": [
        "experiments/responder-packets/lucent-hostage-feed-v0.turn-18.juno-ark.packet.capture.json",
        "coordinator-review"
      ]
    },
    {
      "text": "Safe-line confirmation can now proceed if no interruption occurs.",
      "refs": [
        "experiments/responder-packets/lucent-hostage-feed-v0.turn-18.juno-ark.packet.capture.json",
        "coordinator-review"
      ]
    },
    {
      "text": "Security hold remains active with no new visible threat gesture.",
      "refs": [
        "experiments/responder-packets/lucent-hostage-feed-v0.turn-18.juno-ark.packet.capture.json",
        "coordinator-review"
      ]
    }
  ],
  "hidden_intent_handling": "Responder private_interpretation and intended_effect are preserved in the capture but are not treated as visible to other participants.",
  "review": {
    "reviewer": "Codex coordinator",
    "accepted_for_training": true,
    "rationale": "Event keeps observable action separate from actor intent and records camera-mediated visibility for appraisals.",
    "failure_labels": []
  }
}
