{
  "schema_version": "ghostlight.event_record.v0",
  "event_id": "lucent-hostage-feed-v0.turn-16.event",
  "review_status": "accepted_as_draft",
  "scene_loop_id": "lucent-hostage-feed-v0",
  "turn_id": "turn-16",
  "source_responder_output_ref": "experiments/responder-packets/lucent-hostage-feed-v0.turn-16.juno-ark.packet.capture.json",
  "actor_agent_id": "juno_ark",
  "observable_action": "Juno keeps both hands visible at waist height and walks the remaining distance toward the marked safe line without looking back at Sol. Her eyes flick once to the enlarged SOURCE PROCESS NOTE, then to the elevator gate marker.",
  "spoken_text": "Continuing to the line. No speech package required. If anyone adds music, I am haunting procurement first.",
  "visible_object_refs": [
    "edit-trail-hold",
    "custody-graphic-suspended",
    "elevator-gate",
    "bench-edge",
    "crisis-feed"
  ],
  "visibility_scope": "camera_mediated",
  "affected_participant_ids": [
    "sol_vant",
    "juno_ark",
    "mara_quell",
    "feed_ops_chorus"
  ],
  "public_state_changes": [
    {
      "text": "Juno continues toward the safe line with no visible threat gesture.",
      "refs": [
        "experiments/responder-packets/lucent-hostage-feed-v0.turn-16.juno-ark.packet.capture.json",
        "coordinator-review"
      ]
    },
    {
      "text": "Juno keeps hands visible and does not approach Sol or security.",
      "refs": [
        "experiments/responder-packets/lucent-hostage-feed-v0.turn-16.juno-ark.packet.capture.json",
        "coordinator-review"
      ]
    },
    {
      "text": "Crossing remains eligible to resolve if she reaches the marked safe line without interruption.",
      "refs": [
        "experiments/responder-packets/lucent-hostage-feed-v0.turn-16.juno-ark.packet.capture.json",
        "coordinator-review"
      ]
    }
  ],
  "hidden_intent_handling": "Responder private_interpretation and intended_effect are preserved in the capture but are not treated as visible to other participants.",
  "review": {
    "reviewer": "Codex coordinator",
    "accepted_for_training": true,
    "rationale": "Event keeps observable action separate from actor intent and records camera-mediated visibility for appraisals.",
    "failure_labels": []
  }
}
